{
  "$schema": "http://json-schema.org/draft-07/schema#",
  "$id": "https://openplovdiv.example/schemas/neighbourhood-history.schema.json",
  "title": "Open Plovdiv neighbourhood history",
  "type": "object",
  "additionalProperties": false,
  "required": [
    "id",
    "name_bg",
    "name_en",
    "tagline_bg",
    "tagline_en",
    "summary_bg",
    "summary_en",
    "era_tags",
    "area",
    "district_bg",
    "center",
    "approximate",
    "name_origin_bg",
    "name_origin_en",
    "timeline",
    "place_ids",
    "story_ids",
    "route_ids",
    "getting_there_bg",
    "getting_there_en",
    "sources",
    "data_quality",
    "updated_at",
    "why_bg",
    "why_en",
    "visit"
  ],
  "properties": {
    "id": {
      "type": "string",
      "pattern": "^[a-z0-9][a-z0-9-]+$"
    },
    "name_bg": {
      "type": "string",
      "minLength": 3
    },
    "name_en": {
      "type": "string",
      "minLength": 3
    },
    "tagline_bg": {
      "type": "string",
      "minLength": 10
    },
    "tagline_en": {
      "type": "string",
      "minLength": 10
    },
    "summary_bg": {
      "type": "string",
      "minLength": 120
    },
    "summary_en": {
      "type": "string",
      "minLength": 120
    },
    "era_tags": {
      "type": "array",
      "minItems": 1,
      "maxItems": 3,
      "items": {
        "type": "string",
        "enum": [
          "ottoman",
          "revival",
          "modern",
          "socialist"
        ]
      }
    },
    "area": {
      "type": "string",
      "enum": [
        "centre",
        "north",
        "east",
        "south",
        "west"
      ]
    },
    "district_bg": {
      "type": "string",
      "enum": [
        "Централен",
        "Северен",
        "Източен",
        "Южен",
        "Западен",
        "Тракия"
      ]
    },
    "center": {
      "type": "object",
      "additionalProperties": false,
      "required": [
        "lat",
        "lng"
      ],
      "properties": {
        "lat": {
          "type": "number",
          "minimum": 42.0,
          "maximum": 42.3
        },
        "lng": {
          "type": "number",
          "minimum": 24.5,
          "maximum": 25.0
        }
      }
    },
    "approximate": {
      "type": "boolean",
      "const": true
    },
    "anchor_place_id": {
      "type": [
        "string",
        "null"
      ],
      "pattern": "^place-[0-9a-z-]+$"
    },
    "hero_media": {
      "type": "object",
      "additionalProperties": false,
      "required": [
        "type",
        "title",
        "url",
        "page_url",
        "credit",
        "license",
        "license_url",
        "accessed_at",
        "scope"
      ],
      "properties": {
        "type": {
          "type": "string",
          "enum": [
            "image"
          ]
        },
        "title": {
          "type": "string",
          "minLength": 3
        },
        "url": {
          "type": "string",
          "format": "uri"
        },
        "page_url": {
          "type": "string",
          "format": "uri"
        },
        "credit": {
          "type": "string",
          "minLength": 2
        },
        "license": {
          "type": "string",
          "minLength": 2
        },
        "license_url": {
          "type": "string",
          "format": "uri"
        },
        "accessed_at": {
          "type": "string",
          "format": "date"
        },
        "scope": {
          "type": "string",
          "enum": [
            "neighbourhood",
            "district_context"
          ]
        }
      }
    },
    "name_origin_bg": {
      "type": "string",
      "minLength": 20
    },
    "name_origin_en": {
      "type": "string",
      "minLength": 20
    },
    "coverage_note_bg": {
      "type": "string",
      "minLength": 20
    },
    "coverage_note_en": {
      "type": "string",
      "minLength": 20
    },
    "timeline": {
      "type": "array",
      "minItems": 2,
      "maxItems": 10,
      "items": {
        "type": "object",
        "additionalProperties": false,
        "required": [
          "year",
          "display_bg",
          "display_en",
          "title_bg",
          "title_en",
          "body_bg",
          "body_en"
        ],
        "properties": {
          "year": {
            "type": "integer",
            "minimum": -6000,
            "maximum": 2100
          },
          "display_bg": {
            "type": "string",
            "minLength": 3
          },
          "display_en": {
            "type": "string",
            "minLength": 3
          },
          "title_bg": {
            "type": "string",
            "minLength": 3
          },
          "title_en": {
            "type": "string",
            "minLength": 3
          },
          "body_bg": {
            "type": "string",
            "minLength": 30
          },
          "body_en": {
            "type": "string",
            "minLength": 30
          }
        }
      }
    },
    "place_ids": {
      "type": "array",
      "maxItems": 8,
      "items": {
        "type": "string",
        "pattern": "^place-[0-9a-z-]+$"
      }
    },
    "story_ids": {
      "type": "array",
      "maxItems": 4,
      "items": {
        "type": "string",
        "pattern": "^story-[0-9a-z-]+$"
      }
    },
    "route_ids": {
      "type": "array",
      "maxItems": 4,
      "items": {
        "type": "string",
        "pattern": "^[a-z0-9][a-z0-9-]+$"
      }
    },
    "getting_there_bg": {
      "type": "string",
      "minLength": 30
    },
    "getting_there_en": {
      "type": "string",
      "minLength": 30
    },
    "sources": {
      "type": "array",
      "minItems": 1,
      "maxItems": 6,
      "items": {
        "type": "object",
        "additionalProperties": false,
        "required": [
          "title",
          "url",
          "accessed_at"
        ],
        "properties": {
          "title": {
            "type": "string",
            "minLength": 5
          },
          "url": {
            "type": "string",
            "format": "uri"
          },
          "accessed_at": {
            "type": "string",
            "format": "date"
          }
        }
      }
    },
    "data_quality": {
      "type": "string",
      "minLength": 4
    },
    "updated_at": {
      "type": "string",
      "format": "date"
    },
    "why_bg": {
      "type": "string",
      "minLength": 150
    },
    "why_en": {
      "type": "string",
      "minLength": 150
    },
    "alt_names": {
      "type": "array",
      "maxItems": 4,
      "items": {
        "type": "object",
        "additionalProperties": false,
        "required": [
          "name_bg",
          "name_en"
        ],
        "properties": {
          "name_bg": {
            "type": "string",
            "minLength": 2
          },
          "name_en": {
            "type": "string",
            "minLength": 2
          },
          "note_bg": {
            "type": "string",
            "minLength": 8
          },
          "note_en": {
            "type": "string",
            "minLength": 8
          }
        }
      }
    },
    "fabric": {
      "type": "array",
      "maxItems": 8,
      "items": {
        "type": "object",
        "additionalProperties": false,
        "required": [
          "kind",
          "name_bg",
          "name_en",
          "note_bg",
          "note_en"
        ],
        "properties": {
          "kind": {
            "type": "string",
            "enum": [
              "people",
              "community",
              "industry",
              "institution",
              "faith"
            ]
          },
          "name_bg": {
            "type": "string",
            "minLength": 2
          },
          "name_en": {
            "type": "string",
            "minLength": 2
          },
          "note_bg": {
            "type": "string",
            "minLength": 20
          },
          "note_en": {
            "type": "string",
            "minLength": 20
          },
          "place_id": {
            "type": "string",
            "pattern": "^place-[0-9a-z-]+$"
          }
        }
      }
    },
    "visit": {
      "type": "object",
      "additionalProperties": false,
      "required": [
        "see_bg",
        "see_en",
        "time_bg",
        "time_en",
        "best_bg",
        "best_en",
        "food_bg",
        "food_en"
      ],
      "properties": {
        "see_bg": {
          "type": "string",
          "minLength": 40
        },
        "see_en": {
          "type": "string",
          "minLength": 40
        },
        "time_bg": {
          "type": "string",
          "minLength": 10
        },
        "time_en": {
          "type": "string",
          "minLength": 10
        },
        "best_bg": {
          "type": "string",
          "minLength": 10
        },
        "best_en": {
          "type": "string",
          "minLength": 10
        },
        "food_bg": {
          "type": "string",
          "minLength": 20
        },
        "food_en": {
          "type": "string",
          "minLength": 20
        },
        "respect_bg": {
          "type": "string",
          "minLength": 20
        },
        "respect_en": {
          "type": "string",
          "minLength": 20
        }
      }
    }
  }
}
