[
  {
    "id": "old-town",
    "name_bg": "Старият град",
    "name_en": "The Old Town",
    "tagline_bg": "шест хилядолетия град върху три хълма",
    "tagline_en": "six millennia of city on three hills",
    "summary_bg": "Архитектурно-историческият резерват върху Небет, Джамбаз и Таксим тепе е най-старото обитавано ядро на Пловдив: селище от около 4000 г. пр. Хр., античен акропол и възрожденски къщи в един квартал. Днес резерватът покрива около 35 хектара и от 2004 г. е в индикативната листа на ЮНЕСКО.",
    "summary_en": "The architectural-historical reserve on Nebet, Dzhambaz and Taksim hills is Plovdiv's oldest inhabited core: settlement from around 4000 BC, an ancient acropolis and Revival-era mansions in a single quarter. The reserve covers about 35 hectares and has been on UNESCO's tentative list since 2004.",
    "era_tags": [
      "revival"
    ],
    "area": "centre",
    "district_bg": "Централен",
    "center": {
      "lat": 42.149824,
      "lng": 24.752665
    },
    "approximate": true,
    "anchor_place_id": "place-old-town",
    "name_origin_bg": "Наричан е още Трихълмието — по трите тепета, върху които стои; официалното име на резервата е „Старинен Пловдив“.",
    "name_origin_en": "Also called the Three Hills after the three tepeta it stands on; the reserve's official name is \"Ancient Plovdiv\".",
    "timeline": [
      {
        "year": -4000,
        "display_bg": "ок. 4000 г. пр. Хр.",
        "display_en": "c. 4000 BC",
        "title_bg": "Първо селище",
        "title_en": "First settlement",
        "body_bg": "Върху Небет тепе възниква праисторическо селище — началото на непрекъснатия живот на хълмовете.",
        "body_en": "A prehistoric settlement rises on Nebet Tepe — the start of continuous life on the hills."
      },
      {
        "year": -342,
        "display_bg": "342 г. пр. Хр.",
        "display_en": "342 BC",
        "title_bg": "Филипопол",
        "title_en": "Philippopolis",
        "body_bg": "Филип II Македонски завладява града; акрополът на Трихълмието носи името му през античността.",
        "body_en": "Philip II of Macedon takes the city; through antiquity the Three Hills acropolis carries his name."
      },
      {
        "year": 1847,
        "display_bg": "1847 г.",
        "display_en": "1847",
        "title_bg": "Възрожденските къщи",
        "title_en": "The Revival mansions",
        "body_bg": "Богати търговци строят симетричните къщи с еркери и изписани фасади — Куюмджиевата къща от 1847 г. днес е Етнографският музей.",
        "body_en": "Wealthy merchants build the symmetrical houses with oriels and painted façades — the 1847 Kuyumdzhioglu House is today's Ethnographic Museum."
      },
      {
        "year": 1885,
        "display_bg": "6 септември 1885 г.",
        "display_en": "6 September 1885",
        "title_bg": "Съединението",
        "title_en": "The Unification",
        "body_bg": "От сърцето на квартала е обявено Съединението на Източна Румелия с Княжество България.",
        "body_en": "From the quarter's heart the Unification of Eastern Rumelia with the Principality of Bulgaria is proclaimed."
      },
      {
        "year": 1956,
        "display_bg": "1956 г.",
        "display_en": "1956",
        "title_bg": "Резерватът",
        "title_en": "The reserve",
        "body_bg": "Кварталът е обявен за архитектурно-исторически резерват и започва системна реставрация на къщите.",
        "body_en": "The quarter is declared an architectural-historical reserve and systematic restoration of the houses begins."
      },
      {
        "year": 2004,
        "display_bg": "2004 г.",
        "display_en": "2004",
        "title_bg": "Индикативната листа на ЮНЕСКО",
        "title_en": "UNESCO tentative list",
        "body_bg": "Старинен Пловдив влиза в индикативната листа на ЮНЕСКО за световно наследство.",
        "body_en": "Ancient Plovdiv joins UNESCO's tentative list for World Heritage."
      }
    ],
    "place_ids": [
      "place-nebet-tepe",
      "place-ancient-theatre",
      "place-hisar-kapia",
      "place-plovdiv-regional-ethnographic-museum-q876619",
      "place-hindliyan-house-q19810343",
      "place-balabanov-house-q12272873",
      "place-church-of-st-constantine-and-helena-q5117391",
      "place-lamartine-house"
    ],
    "story_ids": [
      "story-old-plovdiv-restoration",
      "story-revival-houses-schools",
      "story-roman-philippopolis"
    ],
    "route_ids": [
      "old-town-gates-and-churches"
    ],
    "getting_there_bg": "Влиза се пеша от площад Джумая или откъм Хисар капия; уличките са калдъръмени и стръмни, затова тук колите не помагат.",
    "getting_there_en": "Enter on foot from Dzhumaya square or through Hisar Kapia; the lanes are cobbled and steep, so cars are no help here.",
    "sources": [
      {
        "title": "Уикипедия — Старинен Пловдив",
        "url": "https://bg.wikipedia.org/wiki/%D0%A1%D1%82%D0%B0%D1%80%D0%B8%D0%BD%D0%B5%D0%BD_%D0%9F%D0%BB%D0%BE%D0%B2%D0%B4%D0%B8%D0%B2",
        "accessed_at": "2026-07-08"
      },
      {
        "title": "Уикипедия — Пловдив",
        "url": "https://bg.wikipedia.org/wiki/%D0%9F%D0%BB%D0%BE%D0%B2%D0%B4%D0%B8%D0%B2",
        "accessed_at": "2026-06-19"
      }
    ],
    "data_quality": "editorial_neighbourhood_history",
    "updated_at": "2026-07-09",
    "why_bg": "Ако Пловдив претендира да е сред най-старите живи градове в Европа, доказателството е този квартал: шест хилядолетия непрекъснат живот върху три хълма, където тракийска крепост, римски театър и възрожденски салони стоят на една улица. Тук се е обявявало Съединението, тук започва и българската консервация на градско наследство.",
    "why_en": "If Plovdiv claims a place among Europe's oldest living cities, this quarter is the proof: six millennia of unbroken life on three hills, where a Thracian stronghold, a Roman theatre and Revival-era salons share a single street. The Unification was proclaimed here, and Bulgarian urban conservation was born here too.",
    "alt_names": [
      {
        "name_bg": "Трихълмието",
        "name_en": "The Three Hills",
        "note_bg": "по трите тепета на резервата",
        "note_en": "after the reserve's three hills"
      },
      {
        "name_bg": "Старинен Пловдив",
        "name_en": "Ancient Plovdiv",
        "note_bg": "официалното име на резервата",
        "note_en": "the reserve's official name"
      }
    ],
    "fabric": [
      {
        "kind": "institution",
        "name_bg": "Резерватът „Старинен Пловдив“",
        "name_en": "The Ancient Plovdiv reserve",
        "note_bg": "Институцията от 1956 г., която превърна западащите къщи в консервационен образец.",
        "note_en": "The 1956 institution that turned decaying mansions into a conservation model."
      },
      {
        "kind": "community",
        "name_bg": "Възрожденските търговци",
        "name_en": "The Revival merchants",
        "note_bg": "Куюмджиоглу, Хиндлиян, Балабанов — домовете им са музеите на квартала.",
        "note_en": "Kuyumdzhioglu, Hindliyan, Balabanov — their homes are the quarter's museums.",
        "place_id": "place-hindliyan-house-q19810343"
      },
      {
        "kind": "people",
        "name_bg": "Алфонс дьо Ламартин",
        "name_en": "Alphonse de Lamartine",
        "note_bg": "Френският поет отсяда тук през 1833 г. — къщата носи името му.",
        "note_en": "The French poet stayed here in 1833 — the house bears his name.",
        "place_id": "place-lamartine-house"
      },
      {
        "kind": "faith",
        "name_bg": "Храмовете на източното рамо",
        "name_en": "The eastern shoulder's churches",
        "note_bg": "„Св. св. Константин и Елена“ и „Св. Неделя“ пазят зографски иконостаси.",
        "note_en": "St Constantine and Helena and St Nedelya keep master-painted iconostases.",
        "place_id": "place-church-of-st-constantine-and-helena-q5117391"
      }
    ],
    "visit": {
      "see_bg": "Небет тепе, Античния театър, Хисар капия и поне една изписана къща отвътре — Хиндлиян или Етнографския музей.",
      "see_en": "Nebet Tepe, the Ancient Theatre, Hisar Kapia and at least one painted house interior — Hindliyan or the Ethnographic Museum.",
      "time_bg": "Половин ден; цял ден с музеите.",
      "time_en": "Half a day; a full day with the museums.",
      "best_bg": "Рано сутрин за празни улички или late следобед за златна светлина по фасадите.",
      "best_en": "Early morning for empty lanes or late afternoon for golden light on the façades.",
      "food_bg": "В самия резерват заведенията са малко — Капана е на 5 минути надолу с целия си избор.",
      "food_en": "Few eateries inside the reserve — Kapana waits 5 minutes downhill with all the choice."
    }
  },
  {
    "id": "kapana",
    "name_bg": "Капана",
    "name_en": "Kapana",
    "tagline_bg": "занаятчийският „капан“ от улички, днес творческият квартал",
    "tagline_en": "the artisan \"trap\" of lanes, today the creative quarter",
    "summary_bg": "Кварталът между Джумая джамия и Стария град носи плана си от османския пазарен град: тесни улици с имена на занаяти, които се преплитат като капан. Към 1652 г. дюкяните тук наброяват около 880, а след десетилетия упадък през 2014–2019 г. Капана се превърна в квартала на творческите индустрии.",
    "summary_en": "The quarter between Dzhumaya Mosque and the Old Town keeps its plan from the Ottoman market town: narrow craft-named streets interlocking like a trap. By 1652 its shops numbered about 880, and after decades of decline Kapana re-emerged in 2014–2019 as the city's creative-industries quarter.",
    "era_tags": [
      "ottoman",
      "revival"
    ],
    "area": "centre",
    "district_bg": "Централен",
    "center": {
      "lat": 42.149843,
      "lng": 24.748657
    },
    "approximate": true,
    "anchor_place_id": "place-kapana-q12282547",